,url,title,total_score,text,price,category,aspects
819,https://www.google.com/maps/search/?api=1&query=Reo%20Campsite%20-%20BBQ&query_place_id=ChIJWa7AunhrcTERYNCQ8WeWoyc,reo campsite - bbq,4.7,nhóm mình đi trekking vui và nhân viên thân thiện bạn hướng dẫn viên minh rất chu đáo,,camping,{'SERVICE#STAFF': 'POSITIVE'}
820,https://www.google.com/maps/search/?api=1&query=Reo%20Campsite%20-%20BBQ&query_place_id=ChIJWa7AunhrcTERYNCQ8WeWoyc,reo campsite - bbq,4.7,quán đẹp nhân viênt hân thiện nhất là anh minh chụp hình đẹp thân thiện vui tính 10,,camping,{'SERVICE#STAFF': 'POSITIVE'}
821,https://www.google.com/maps/search/?api=1&query=Reo%20Campsite%20-%20BBQ&query_place_id=ChIJWa7AunhrcTERYNCQ8WeWoyc,reo campsite - bbq,4.7,cảnh đẹp. ở có 2 bạn nhân viên duyên với huyền dễ thương và rất nhiệt tình.,,camping,"{'ENVIRONMENT#SCENERY': 'POSITIVE', 'SERVICE#STAFF': 'POSITIVE'}"
822,https://www.google.com/maps/search/?api=1&query=Reo%20Campsite%20-%20BBQ&query_place_id=ChIJWa7AunhrcTERYNCQ8WeWoyc,reo campsite - bbq,4.7,bạn trường dễ thương,,camping,{}
823,https://www.google.com/maps/search/?api=1&query=Reo%20Campsite%20-%20BBQ&query_place_id=ChIJWa7AunhrcTERYNCQ8WeWoyc,reo campsite - bbq,4.7,bạn trường đẹp trai,,camping,{}
824,https://www.google.com/maps/search/?api=1&query=Reo%20Campsite%20-%20BBQ&query_place_id=ChIJWa7AunhrcTERYNCQ8WeWoyc,reo campsite - bbq,4.7,anh minh và anh an rất nhiệt tình,,camping,{'SERVICE#STAFF': 'POSITIVE'}
825,https://www.google.com/maps/search/?api=1&query=Reo%20Campsite%20-%20BBQ&query_place_id=ChIJWa7AunhrcTERYNCQ8WeWoyc,reo campsite - bbq,4.7,an và minh tốt,,camping,{}
826,https://www.google.com/maps/search/?api=1&query=Reo%20Campsite%20-%20BBQ&query_place_id=ChIJWa7AunhrcTERYNCQ8WeWoyc,reo campsite - bbq,4.7,"trải nghiệm chèo sup ở hồ tuyền lâm thật tuyệt vời! khung cảnh sáng sớm mờ sương, nước trong vắt, không khí mát lạnh. hướng dẫn viên nhiệt tình, dịch vụ chuyên nghiệp. rất phù hợp để thư giãn và chụp ảnh sống ảo. nhất định sẽ quay lại!",,camping,"{'ENVIRONMENT#WEATHER': 'POSITIVE', 'ENVIRONMENT#SCENERY': 'POSITIVE', 'ENVIRONMENT#ATMOSPHERE': 'NEUTRAL', 'SERVICE#STAFF': 'POSITIVE'}"
827,https://www.google.com/maps/search/?api=1&query=Reo%20Campsite%20-%20BBQ&query_place_id=ChIJWa7AunhrcTERYNCQ8WeWoyc,reo campsite - bbq,4.7,trường tài vũ bình huyền duyên vũ đẹp trai xinh gái nhiệt tình,,camping,{'SERVICE#STAFF': 'POSITIVE'}
828,https://www.google.com/maps/search/?api=1&query=Reo%20Campsite%20-%20BBQ&query_place_id=ChIJWa7AunhrcTERYNCQ8WeWoyc,reo campsite - bbq,4.7,"mình ghé vào một đêm tối thui không thấy nhiều cảnh đẹp, các bạn nhân viên rất nhiệt tình, cầm ô che cho mình từ bãi xe, hướng dẫn lối đi xuống và lên, tuyệt vời",,camping,"{'LOCATION': 'POSITIVE', 'ENVIRONMENT#SCENERY': 'POSITIVE', 'ENVIRONMENT#WEATHER': 'POSITIVE', 'SERVICE#STAFF': 'POSITIVE'}"
829,https://www.google.com/maps/search/?api=1&query=Reo%20Campsite%20-%20BBQ&query_place_id=ChIJWa7AunhrcTERYNCQ8WeWoyc,reo campsite - bbq,4.7,"trải nghiệm chèo sup tại reo hồ tuyền lâm thực sự rất tuyệt vời! được bạn hướng dẫn viên tên an đồng hành xuyên suốt chuyến đi, bạn rất dễ thương, nhiệt tình và luôn lan toả nguồn năng lượng tích cực. hướng dẫn chi tiết, chăm sóc khách chu đáo từ anh z. phong cảnh hồ buổi sáng đẹp mê ly, không khí trong lành. một trải nghiệm đáng giá khi đến đà lạt – nhẹ nhàng nhưng đầy cảm xúc!",,camping,"{'ENVIRONMENT#WEATHER': 'POSITIVE', 'ENVIRONMENT#ATMOSPHERE': 'POSITIVE', 'SERVICE#STAFF': 'POSITIVE', 'ENVIRONMENT#SCENERY': 'POSITIVE', 'PRICE': 'POSITIVE'}"
830,https://www.google.com/maps/search/?api=1&query=Reo%20Campsite%20-%20BBQ&query_place_id=ChIJWa7AunhrcTERYNCQ8WeWoyc,reo campsite - bbq,4.7,anh an chèo súp dễ thương phô mai quê trần nghĩa đánh giá,,camping,{'SERVICE#STAFF': 'POSITIVE'}
831,https://www.google.com/maps/search/?api=1&query=Reo%20Campsite%20-%20BBQ&query_place_id=ChIJWa7AunhrcTERYNCQ8WeWoyc,reo campsite - bbq,4.7,"chỗ ở rộng rãi, thoáng mát, đối diện hồ tuyền lâm luôn nên tha hồ chụp ảnh. mấy anh nvien nói chuyện vễ thưn với chìu khách cực, mới làm quen được anh thuận với anh an nma nhìn chung là vễ thưn cực",,camping,"{'ENVIRONMENT#ATMOSPHERE': 'NEUTRAL', 'ENVIRONMENT#WEATHER': 'NEUTRAL', 'SERVICE#STAFF': 'NEUTRAL'}"
832,https://www.google.com/maps/search/?api=1&query=Reo%20Campsite%20-%20BBQ&query_place_id=ChIJWa7AunhrcTERYNCQ8WeWoyc,reo campsite - bbq,4.7,"các bạn nhân viên dễ thương, nhiệt tình, view thiên nhiên thư giãn.",,camping,"{'ENVIRONMENT#SCENERY': 'POSITIVE', 'SERVICE#STAFF': 'POSITIVE'}"
833,https://www.google.com/maps/search/?api=1&query=Reo%20Campsite%20-%20BBQ&query_place_id=ChIJWa7AunhrcTERYNCQ8WeWoyc,reo campsite - bbq,4.7,an nhiệt tình lắm nè nên book an chèo sup nhé các bạn,,camping,{'SERVICE#STAFF': 'POSITIVE'}
834,https://www.google.com/maps/search/?api=1&query=Reo%20Campsite%20-%20BBQ&query_place_id=ChIJWa7AunhrcTERYNCQ8WeWoyc,reo campsite - bbq,4.7,"mình đăng kí chèo sup suối tía 450k người. rất xứng đáng luôn, với thời tiết tháng 5 này hay mưa chiều thì mọi người nên chọn đi buổi sáng cho đỡ mưa. tuỳ hôm sẽ có sương hoặc không. hôm mình đi có sương nhưng ít nên chỉ thấy được mờ mờ. nhưng vì sáng sớm, không khí se lạnh mát mẻ nên cực kì thư giãn. anh hướng dẫn đi chung vui vẻ, cùng gu nhạc với mình, chụp ảnh có tâm, 100đ",,camping,"{'PRICE': 'NEUTRAL', 'ENVIRONMENT#WEATHER': 'POSITIVE', 'ENVIRONMENT#ATMOSPHERE': 'POSITIVE', 'SERVICE#STAFF': 'POSITIVE'}"
835,https://www.google.com/maps/search/?api=1&query=Reo%20Campsite%20-%20BBQ&query_place_id=ChIJWa7AunhrcTERYNCQ8WeWoyc,reo campsite - bbq,4.7,mọi người đường vô quán này. view của thiên nhiên đầu tư không bao nhiêu mà lấy tiền nước mắc. mình có nhờ chế cho mình miếng nước mì mình có đem theo. bao nhiu thì tính tiền chứ sao pải thái độ với khách,,camping,"{'LOCATION': 'POSITIVE', 'PRICE': 'NEUTRAL', 'ENVIRONMENT#SCENERY': 'POSITIVE', 'SERVICE#STAFF': 'NEGATIVE'}"
836,https://www.google.com/maps/search/?api=1&query=Reo%20Campsite%20-%20BBQ&query_place_id=ChIJWa7AunhrcTERYNCQ8WeWoyc,reo campsite - bbq,4.7,nhân viên chụp hình đẹp,,camping,{'SERVICE#STAFF': 'NEUTRAL'}
837,https://www.google.com/maps/search/?api=1&query=Reo%20Campsite%20-%20BBQ&query_place_id=ChIJWa7AunhrcTERYNCQ8WeWoyc,reo campsite - bbq,4.7,"nhân viên nhiệt tình, các bạn trường vũ huyền phi rất dễ thương lun, chèo sup cũng zui. must tryy",,camping,{'SERVICE#STAFF': 'POSITIVE'}
838,https://www.google.com/maps/search/?api=1&query=Reo%20Campsite%20-%20BBQ&query_place_id=ChIJWa7AunhrcTERYNCQ8WeWoyc,reo campsite - bbq,4.7,"côn trùng lắm bây ơi, ngồi chơi tí rồi về chứ ở lại hơi khó",,camping,{'SERVICE#STAFF': 'NEUTRAL'}
839,https://www.google.com/maps/search/?api=1&query=Reo%20Campsite%20-%20BBQ&query_place_id=ChIJWa7AunhrcTERYNCQ8WeWoyc,reo campsite - bbq,4.7,"mọi người cân nhắc, đừng bị maketing lừa, quán không có một cái gì hết, nước thì dỡ, view sông mùa này không có nước gì mấy đâu.",,camping,{'ENVIRONMENT#SCENERY': 'POSITIVE'}
840,https://www.google.com/maps/search/?api=1&query=Reo%20Campsite%20-%20BBQ&query_place_id=ChIJWa7AunhrcTERYNCQ8WeWoyc,reo campsite - bbq,4.7,chèo súp sáng sớm view chill xỉu,,camping,"{'ENVIRONMENT#SCENERY': 'POSITIVE', 'ENVIRONMENT#WEATHER': 'NEUTRAL'}"
841,https://www.google.com/maps/search/?api=1&query=Reo%20Campsite%20-%20BBQ&query_place_id=ChIJWa7AunhrcTERYNCQ8WeWoyc,reo campsite - bbq,4.7,"rất chill nha, giá ổn áp. thích chèo sup lắm",,camping,{'PRICE': 'NEUTRAL'}
842,https://www.google.com/maps/search/?api=1&query=Reo%20Campsite%20-%20BBQ&query_place_id=ChIJWa7AunhrcTERYNCQ8WeWoyc,reo campsite - bbq,4.7,"nước giá hơi cao 80k, đổi lại có view khá ổn",,camping,"{'PRICE': 'NEGATIVE', 'ENVIRONMENT#SCENERY': 'POSITIVE'}"
843,https://www.google.com/maps/search/?api=1&query=Reo%20Campsite%20-%20BBQ&query_place_id=ChIJWa7AunhrcTERYNCQ8WeWoyc,reo campsite - bbq,4.7,"mình đã quay lại đây lần 2, và vẫn rất chill ạ. anh tuấn và anh tiến take care khách rất kĩ ạ. đi một mình vẫn có ảnh xinh từ anh tuấn chụp cho ạ. cảm ơn các anh nhân viên ở đây ạ, mình sẽ quay lại nhiều lần nữa.",,camping,{'SERVICE#STAFF': 'NEUTRAL'}
844,https://www.google.com/maps/search/?api=1&query=Reo%20Campsite%20-%20BBQ&query_place_id=ChIJWa7AunhrcTERYNCQ8WeWoyc,reo campsite - bbq,4.7,"đẹp, nhưng bữa mình đi hơi đông v giá nước khá cao á. nhưng mà đẹp v chill lắm",,camping,{'PRICE': 'NEGATIVE'}
845,https://www.google.com/maps/search/?api=1&query=Reo%20Campsite%20-%20BBQ&query_place_id=ChIJWa7AunhrcTERYNCQ8WeWoyc,reo campsite - bbq,4.7,ê 100đ nha,,camping,{'PRICE': 'NEUTRAL'}
846,https://www.google.com/maps/search/?api=1&query=Reo%20Campsite%20-%20BBQ&query_place_id=ChIJWa7AunhrcTERYNCQ8WeWoyc,reo campsite - bbq,4.7,"bạn nhân viên tài rất nhiệt tình , vui vẻ , dễ thương",,camping,{'SERVICE#STAFF': 'POSITIVE'}
847,https://www.google.com/maps/search/?api=1&query=Reo%20Campsite%20-%20BBQ&query_place_id=ChIJWa7AunhrcTERYNCQ8WeWoyc,reo campsite - bbq,4.7,"vị trí đẹp, có chỗ camping, chèo sup. bạn nhân viên tên huyền nhiệt tình hỗ trợ khi mình không đủ xăng về lại thành phố, cảm ơn reo và cảm ơn các bạn nhân viên.",,camping,"{'LOCATION': 'POSITIVE', 'SERVICE#STAFF': 'POSITIVE'}"
848,https://www.google.com/maps/search/?api=1&query=Reo%20Campsite%20-%20BBQ&query_place_id=ChIJWa7AunhrcTERYNCQ8WeWoyc,reo campsite - bbq,4.7,"bọn mình mua gói camping qua đêm và chèo sup suối tía buổi sáng. điểm cộng: nhân viên lễ phép, nice. đồ ăn ổn. địa điểm ngắm hồ đẹp. lều trại sạch sẽ. điểm trừ: không dọn ly nhựa người khi khách uống ng, nhìn các ly nhựa bừa bãi trên bàn khá mất mĩ quan. nếu các bạn nhân viên không dọn được liên tục thì nên có biển hướng dẫn khách tự mang bỏ cốc sau khi dùng ng. mình chọn ở lại qua đêm vì muốn chèo sup sớm ngắm bình mình và suối tía khi mặt trời mới lên. nhưng tour đi buổi sáng bắt đầu quá muộn, khoảng 6h mới xuất phát. khi đó bình minh đã không còn, lúc chèo về thì bị nắng. là một người không thích nắng và đã mất công ở lại qua đêm nên mình khá thất vọng vì các video pr trên mạng thì toàn thấy đi từ lúc tờ mờ sáng.",,camping,"{'ENVIRONMENT#WEATHER': 'NEUTRAL', 'SERVICE#STAFF': 'NEUTRAL', 'ENVIRONMENT#SCENERY': 'POSITIVE'}"
849,https://www.google.com/maps/search/?api=1&query=Reo%20Campsite%20-%20BBQ&query_place_id=ChIJWa7AunhrcTERYNCQ8WeWoyc,reo campsite - bbq,4.7,"cảnh đẹp, dịch vụ ổn, đồ ăn nhiều. gia đình mình đi 23 người lớn và 6 trẻ em. đặt chèo sup và ăn trưa. bạn nhân viên tư vấn nhiệt tình!",,camping,"{'ENVIRONMENT#SCENERY': 'POSITIVE', 'SERVICE#STAFF': 'POSITIVE', 'PRICE': 'NEUTRAL'}"
850,https://www.google.com/maps/search/?api=1&query=Reo%20Campsite%20-%20BBQ&query_place_id=ChIJWa7AunhrcTERYNCQ8WeWoyc,reo campsite - bbq,4.7,giá nước chát quá . đi 1 năm trước 30 35k giờ lên 80k siêu cao luôn. trong khi nước tạm . chẳng hiểu vì lí do gì lên giá cao như vậy,,camping,{'PRICE': 'NEGATIVE'}
851,https://www.google.com/maps/search/?api=1&query=Reo%20Campsite%20-%20BBQ&query_place_id=ChIJWa7AunhrcTERYNCQ8WeWoyc,reo campsite - bbq,4.7,nhân viên nhiệt tình chơi siêu vui,,camping,{'SERVICE#STAFF': 'POSITIVE'}
852,https://www.google.com/maps/search/?api=1&query=Reo%20Campsite%20-%20BBQ&query_place_id=ChIJWa7AunhrcTERYNCQ8WeWoyc,reo campsite - bbq,4.7,"cũng chill view hồ cực mát mẻ chụp ảnh cũng rất đẹp, nước hơi chát nma lâu lâu 1 lần cũng được",,camping,"{'PRICE': 'NEUTRAL', 'ENVIRONMENT#SCENERY': 'POSITIVE', 'ENVIRONMENT#WEATHER': 'POSITIVE'}"
853,https://www.google.com/maps/search/?api=1&query=Reo%20Campsite%20-%20BBQ&query_place_id=ChIJWa7AunhrcTERYNCQ8WeWoyc,reo campsite - bbq,4.7,mình và bạn trai chèo sup ở đây được anh tuấn hỗ trợ rất nhiệt tình luôn mình rất ấn tượng với cách anh ấy hỗ trợ khách hàng mình đưa máy quay hay máy ảnh gì ảnh cũng cố gắng hỗ trợ tụi mình trong suốt chuyến đi mình rất recommend chỗ này nhé vì cảnh thì đẹp còn nhân viên thì quá nhiệt tình 10 10 ạ,,camping,"{'ENVIRONMENT#SCENERY': 'POSITIVE', 'SERVICE#STAFF': 'POSITIVE'}"
854,https://www.google.com/maps/search/?api=1&query=Reo%20Campsite%20-%20BBQ&query_place_id=ChIJWa7AunhrcTERYNCQ8WeWoyc,reo campsite - bbq,4.7,hôm nay mình chèo sup bên reo được bạn tuấn hoặc mọi người có thể gọi là khoai hỗ trợ rất tốt bạn rất chịu khó chèo theo tụi mình để hỗ trợ chụp hình hi vọng lần sau quay lại có thể gặp lại bạn mọi người tới chơi có thể nhờ bạn tuấn chụp hình nhé. bạn rất dễ thương và nhiệt tình,,camping,{'SERVICE#STAFF': 'POSITIVE'}
855,https://www.google.com/maps/search/?api=1&query=Reo%20Campsite%20-%20BBQ&query_place_id=ChIJWa7AunhrcTERYNCQ8WeWoyc,reo campsite - bbq,4.7,"mình đăng kí chèo sup bên reo bên họ take care cho khách hàng rất tốt buổi tối trước ngày đi họ gọi dặn đo mình rất kĩ kĩ năng tiếp khách, hỗ trợ lúc team mình tới cũng rất nhiệt tình và chuyên nghiệp mình và bạn gái có nhờ 1 bạn hướng dẫn viên đi cùng hỗ trợ quay chụp và bạn hỗ trợ cực kì nhiệt tình bạn tên là tuấn mọi người hay gọi là khoai giúp đỡ mình trong chuyến đi rất nhiều thực sự mình đánh giá rất cao bạn, mọi người đi chơi có thể gặp bạn nhờ bạn hỗ trợ nói chung trải nghiệm lần này của mình tại reo là 10 10 view cảnh, nhân viên mọi thứ đều rất tốt",,camping,"{'PRICE': 'NEGATIVE', 'ENVIRONMENT#SCENERY': 'POSITIVE', 'ENVIRONMENT#WEATHER': 'NEUTRAL', 'SERVICE#STAFF': 'POSITIVE'}"
856,https://www.google.com/maps/search/?api=1&query=Reo%20Campsite%20-%20BBQ&query_place_id=ChIJWa7AunhrcTERYNCQ8WeWoyc,reo campsite - bbq,4.7,"ban tuấn hướng dẫn viên chụp hình đẹp, vui vẻ, tận tâm",,camping,{'SERVICE#STAFF': 'POSITIVE'}
857,https://www.google.com/maps/search/?api=1&query=Reo%20Campsite%20-%20BBQ&query_place_id=ChIJWa7AunhrcTERYNCQ8WeWoyc,reo campsite - bbq,4.7,"bạn tuấn chụp hình rất đẹp, cảnh chill 10 đỉm",,camping,"{'PRICE': 'NEUTRAL', 'ENVIRONMENT#SCENERY': 'POSITIVE'}"
858,https://www.google.com/maps/search/?api=1&query=Reo%20Campsite%20-%20BBQ&query_place_id=ChIJWa7AunhrcTERYNCQ8WeWoyc,reo campsite - bbq,4.7,"bạn tuấn thân thiện, hướng dẫn chèo sup rất nhiệt tình, nếu có dịp sẽ ghé lại lần nữa",,camping,{'SERVICE#STAFF': 'POSITIVE'}
859,https://www.google.com/maps/search/?api=1&query=Reo%20Campsite%20-%20BBQ&query_place_id=ChIJWa7AunhrcTERYNCQ8WeWoyc,reo campsite - bbq,4.7,"trải nghiệm chèo sup 10 . có áo phao an toàn. anh tuấn hướng dẫn viên chụp hình đẹp, luôn chèo theo sau hướng dẫn, vui vẻ, tận tâm",,camping,{'SERVICE#STAFF': 'POSITIVE'}
860,https://www.google.com/maps/search/?api=1&query=Reo%20Campsite%20-%20BBQ&query_place_id=ChIJWa7AunhrcTERYNCQ8WeWoyc,reo campsite - bbq,4.7,"cảnh chill, góc nào sống ảo cũng đẹp. có dịp lên đl sẽ ghé reo tiếp. cảm ơn anh tuấn đã take care nhiệt tình",,camping,"{'ENVIRONMENT#SCENERY': 'POSITIVE', 'SERVICE#STAFF': 'POSITIVE'}"
861,https://www.google.com/maps/search/?api=1&query=Reo%20Campsite%20-%20BBQ&query_place_id=ChIJWa7AunhrcTERYNCQ8WeWoyc,reo campsite - bbq,4.7,"lần đầu trải nghiệm xứng đáng , không gian rất chill, các bạn nhân viên rất nhiệt tình, dẽ thương quá à, có cơ hội sẽ tới tiếp",,camping,"{'ENVIRONMENT#ATMOSPHERE': 'POSITIVE', 'SERVICE#STAFF': 'POSITIVE'}"
862,https://www.google.com/maps/search/?api=1&query=Reo%20Campsite%20-%20BBQ&query_place_id=ChIJWa7AunhrcTERYNCQ8WeWoyc,reo campsite - bbq,4.7,"hôm đi ít mây nhưng mà mấy bạn nhân viên nhiệt tình, lêu hơi cũ. đồ ăn ngon, có bắn cung, nướng khoai lang, ăn báp. nên có nhiều hơn động hơn",,camping,{'SERVICE#STAFF': 'POSITIVE'}
863,https://www.google.com/maps/search/?api=1&query=Reo%20Campsite%20-%20BBQ&query_place_id=ChIJWa7AunhrcTERYNCQ8WeWoyc,reo campsite - bbq,4.7,các anh hướng dẫn viên rất dễ thương và quán phục vụ ok,,camping,{'SERVICE#STAFF': 'POSITIVE'}
864,https://www.google.com/maps/search/?api=1&query=Reo%20Campsite%20-%20BBQ&query_place_id=ChIJWa7AunhrcTERYNCQ8WeWoyc,reo campsite - bbq,4.7,"nhân viên nhiệt tình, chụp hình siêu đẹp",,camping,{'SERVICE#STAFF': 'POSITIVE'}
865,https://www.google.com/maps/search/?api=1&query=Reo%20Campsite%20-%20BBQ&query_place_id=ChIJWa7AunhrcTERYNCQ8WeWoyc,reo campsite - bbq,4.7,"bạn hướng dẫn viên minh chụp hình đẹp,nhiệt tình,bạn an hướng dẫn nhiệt tình",,camping,{'SERVICE#STAFF': 'POSITIVE'}
866,https://www.google.com/maps/search/?api=1&query=Reo%20Campsite%20-%20BBQ&query_place_id=ChIJWa7AunhrcTERYNCQ8WeWoyc,reo campsite - bbq,4.7,"lâu lâu lên đà lạt ghé đây đúng là lựa chọn đúng đắn, không khí trong lành, phục vụ nhiệt tình, đánh trải nghiệm!",,camping,"{'ENVIRONMENT#ATMOSPHERE': 'POSITIVE', 'SERVICE#STAFF': 'POSITIVE'}"
867,https://www.google.com/maps/search/?api=1&query=Reo%20Campsite%20-%20BBQ&query_place_id=ChIJWa7AunhrcTERYNCQ8WeWoyc,reo campsite - bbq,4.7,phục vụ trường và vũ tận tâm nhá,,camping,{'SERVICE#STAFF': 'POSITIVE'}
868,https://www.google.com/maps/search/?api=1&query=Reo%20Campsite%20-%20BBQ&query_place_id=ChIJWa7AunhrcTERYNCQ8WeWoyc,reo campsite - bbq,4.7,"thoáng mát, mát mẻ, yên tĩnh cách xa thành phố phù hợp để chill và thư giãn cùng bạn bè.nước khá oke, chèo sup vui,các bạn nhân viên nhiệt tình, vui vẻ, lúc nào cũng đi nhặt rác ly của khách bỏ lại. 10 điểm không có nhưng",,camping,"{'ENVIRONMENT#ATMOSPHERE': 'POSITIVE', 'ENVIRONMENT#WEATHER': 'POSITIVE', 'SERVICE#STAFF': 'POSITIVE', 'PRICE': 'NEUTRAL'}"
869,https://www.google.com/maps/search/?api=1&query=Reo%20Campsite%20-%20BBQ&query_place_id=ChIJWa7AunhrcTERYNCQ8WeWoyc,reo campsite - bbq,4.7,"nhân viên nhiệt tình, đặc biệt là bạn nữ với bạn trường và bạn vũ pha chế nước ngon không gian thoáng mát",,camping,"{'ENVIRONMENT#ATMOSPHERE': 'NEUTRAL', 'ENVIRONMENT#WEATHER': 'NEUTRAL', 'SERVICE#STAFF': 'POSITIVE'}"
870,https://www.google.com/maps/search/?api=1&query=Reo%20Campsite%20-%20BBQ&query_place_id=ChIJWa7AunhrcTERYNCQ8WeWoyc,reo campsite - bbq,4.7,"quán nhân viên dễ thương nhiệt tình vui vẻ đặc biệt là bạn trường , vũ , tài , huyền , mỹ, bình , quỳnh , tuấn ,",,camping,{'SERVICE#STAFF': 'POSITIVE'}
871,https://www.google.com/maps/search/?api=1&query=Reo%20Campsite%20-%20BBQ&query_place_id=ChIJWa7AunhrcTERYNCQ8WeWoyc,reo campsite - bbq,4.7,"nhân viên thân thiện, nhiệt tình, đặc biệt là bạn trường nói chuyện nhẹ nhàng.",,camping,{'SERVICE#STAFF': 'POSITIVE'}
872,https://www.google.com/maps/search/?api=1&query=Reo%20Campsite%20-%20BBQ&query_place_id=ChIJWa7AunhrcTERYNCQ8WeWoyc,reo campsite - bbq,4.7,"mỹ, trường, tiến hỗ trợ nhiệt tình, chuyến đi tuyệt vời",,camping,"{'ENVIRONMENT#WEATHER': 'POSITIVE', 'SERVICE#STAFF': 'POSITIVE'}"
873,https://www.google.com/maps/search/?api=1&query=Reo%20Campsite%20-%20BBQ&query_place_id=ChIJWa7AunhrcTERYNCQ8WeWoyc,reo campsite - bbq,4.7,tuyệt vời chill đét,,camping,{'ENVIRONMENT#WEATHER': 'POSITIVE'}
874,https://www.google.com/maps/search/?api=1&query=Reo%20Campsite%20-%20BBQ&query_place_id=ChIJWa7AunhrcTERYNCQ8WeWoyc,reo campsite - bbq,4.7,dịch vụ tốt nhân viên dễ thương,,camping,{'SERVICE#STAFF': 'POSITIVE'}
875,https://www.google.com/maps/search/?api=1&query=Reo%20Campsite%20-%20BBQ&query_place_id=ChIJWa7AunhrcTERYNCQ8WeWoyc,reo campsite - bbq,4.7,"nhân viên siêu nhiệt tình , dễ thương dễ thương phô mai que , view bao đẹp , đồ ăn siêu ngon luôn nha các ní ơi",,camping,"{'ENVIRONMENT#SCENERY': 'POSITIVE', 'SERVICE#STAFF': 'POSITIVE'}"
876,https://www.google.com/maps/search/?api=1&query=Reo%20Campsite%20-%20BBQ&query_place_id=ChIJWa7AunhrcTERYNCQ8WeWoyc,reo campsite - bbq,4.7,đi người về luỵ lunn,,camping,{}
877,https://www.google.com/maps/search/?api=1&query=Reo%20Campsite%20-%20BBQ&query_place_id=ChIJWa7AunhrcTERYNCQ8WeWoyc,reo campsite - bbq,4.7,"thư giãn, thoải mái, view thơ mộng",,camping,{'ENVIRONMENT#SCENERY': 'POSITIVE'}
878,https://www.google.com/maps/search/?api=1&query=Reo%20Campsite%20-%20BBQ&query_place_id=ChIJWa7AunhrcTERYNCQ8WeWoyc,reo campsite - bbq,4.7,cảnh đẹp đi sáng sớm có thể săn được mây. nhân viên tận tình được anh mỹ hướng dẫn tận tình và chụp được nhiều ảnh đẹp ở đây.,,camping,"{'ENVIRONMENT#SCENERY': 'POSITIVE', 'ENVIRONMENT#WEATHER': 'POSITIVE', 'SERVICE#STAFF': 'POSITIVE'}"
879,https://www.google.com/maps/search/?api=1&query=Reo%20Campsite%20-%20BBQ&query_place_id=ChIJWa7AunhrcTERYNCQ8WeWoyc,reo campsite - bbq,4.7,chèo vào buổi sớm mát lạnh . chill dữ cảnh thì đẹp thơ đb săn được mây khi chèo 50 70,,camping,"{'ENVIRONMENT#WEATHER': 'NEUTRAL', 'ENVIRONMENT#SCENERY': 'POSITIVE'}"
880,https://www.google.com/maps/search/?api=1&query=Reo%20Campsite%20-%20BBQ&query_place_id=ChIJWa7AunhrcTERYNCQ8WeWoyc,reo campsite - bbq,4.7,"khu camping siêu chill và xinh, cảm giác được hoà mình với thiên nhiên thích lắm. nhân viên nhiệt tình dễ thương, support lắm á. bạn an chụp ảnh cho tụi mình siêu đẹp",,camping,"{'ENVIRONMENT#SCENERY': 'POSITIVE', 'ENVIRONMENT#ATMOSPHERE': 'POSITIVE', 'SERVICE#STAFF': 'POSITIVE'}"
881,https://www.google.com/maps/search/?api=1&query=Reo%20Campsite%20-%20BBQ&query_place_id=ChIJWa7AunhrcTERYNCQ8WeWoyc,reo campsite - bbq,4.7,an chụp hình rất đẹp cảm ơn em an nhé,,camping,{}
882,https://www.google.com/maps/search/?api=1&query=Reo%20Campsite%20-%20BBQ&query_place_id=ChIJWa7AunhrcTERYNCQ8WeWoyc,reo campsite - bbq,4.7,an chụp hình bao đẹp dui dẻ,,camping,{}
883,https://www.google.com/maps/search/?api=1&query=Reo%20Campsite%20-%20BBQ&query_place_id=ChIJWa7AunhrcTERYNCQ8WeWoyc,reo campsite - bbq,4.7,"camping trọn gói: ngủ lều,chèo sup, bbq 950k người . cảnh đẹp thiên nhiên.",,camping,"{'PRICE': 'NEUTRAL', 'ENVIRONMENT#WEATHER': 'NEUTRAL', 'ENVIRONMENT#SCENERY': 'POSITIVE'}"
884,https://www.google.com/maps/search/?api=1&query=Reo%20Campsite%20-%20BBQ&query_place_id=ChIJWa7AunhrcTERYNCQ8WeWoyc,reo campsite - bbq,4.7,"tuyệt vời! nhân viên siêu nhiệt tình, đặc biệt là bạn an support từ anh vậy siêu tốt!",,camping,"{'ENVIRONMENT#WEATHER': 'POSITIVE', 'SERVICE#STAFF': 'POSITIVE'}"
885,https://www.google.com/maps/search/?api=1&query=Reo%20Campsite%20-%20BBQ&query_place_id=ChIJWa7AunhrcTERYNCQ8WeWoyc,reo campsite - bbq,4.7,minh hướng dẫn viên tuyệt vời chu đáo hiền lành dễ thuong quá troi . mình từ ha noi vào cảm ơn reo nhen,,camping,"{'ENVIRONMENT#WEATHER': 'POSITIVE', 'SERVICE#STAFF': 'POSITIVE'}"
886,https://www.google.com/maps/search/?api=1&query=Reo%20Campsite%20-%20BBQ&query_place_id=ChIJWa7AunhrcTERYNCQ8WeWoyc,reo campsite - bbq,4.7,mình đã ghé thử và được bạn minh hướng dẫn và hỗ trợ rất nhiệt tình và thân thiện ạ.,,camping,{'SERVICE#STAFF': 'POSITIVE'}
887,https://www.google.com/maps/search/?api=1&query=Reo%20Campsite%20-%20BBQ&query_place_id=ChIJWa7AunhrcTERYNCQ8WeWoyc,reo campsite - bbq,4.7,"không gian rộng rãi thoáng nát ,nước theo cảm nhận của mình thì ngon vừa miệng ,nhân viên nhiệt tình dễ thương đặc biệt là bạn nữ oder",,camping,"{'ENVIRONMENT#ATMOSPHERE': 'POSITIVE', 'SERVICE#STAFF': 'POSITIVE'}"
888,https://www.google.com/maps/search/?api=1&query=Reo%20Campsite%20-%20BBQ&query_place_id=ChIJWa7AunhrcTERYNCQ8WeWoyc,reo campsite - bbq,4.7,"anh minh chụp hình đẹp ,nhiệt tình,lần sau sẽ ghé lại ạ",,camping,{'SERVICE#STAFF': 'POSITIVE'}
889,https://www.google.com/maps/search/?api=1&query=Reo%20Campsite%20-%20BBQ&query_place_id=ChIJWa7AunhrcTERYNCQ8WeWoyc,reo campsite - bbq,4.7,minh tuyet voi,,camping,{}
890,https://www.google.com/maps/search/?api=1&query=Reo%20Campsite%20-%20BBQ&query_place_id=ChIJWa7AunhrcTERYNCQ8WeWoyc,reo campsite - bbq,4.7,cảm mơn bạn nhân viên minh đã hỗ trợ mình nhiệt tình ạ,,camping,{'SERVICE#STAFF': 'POSITIVE'}
891,https://www.google.com/maps/search/?api=1&query=Reo%20Campsite%20-%20BBQ&query_place_id=ChIJWa7AunhrcTERYNCQ8WeWoyc,reo campsite - bbq,4.7,"cảm ưn bạn nhân viên minh hỗ trợ rất nhiệt tình nha, để lại cho tụi tớ chuyến đi đà lạt đáng nhớ tại reo",,camping,{'SERVICE#STAFF': 'POSITIVE'}
